{
  "$schema": "../scaffold.config.schema.json",
  "version": "1",
  "productName": "Prove Auth Card",
  "defaultSurface": "light",
  "primaryHex": "#3b82f6",
  "accentHex": "#6366f1",
  "container": "full",
  "cardStyle": "shadow",
  "authLayout": "card",
  "includeRegister": false,
  "dashboards": ["Overview"],
  "starterModules": [],
  "advancedFeatures": []
}
