{
  "$schema": "../scaffold.config.schema.json",
  "version": "1",
  "productName": "Prove Register On",
  "defaultSurface": "light",
  "primaryHex": "#3b82f6",
  "accentHex": "#6366f1",
  "container": "full",
  "cardStyle": "shadow",
  "authLayout": "split",
  "includeRegister": true,
  "dashboards": ["Overview"],
  "starterModules": [],
  "advancedFeatures": []
}
